{
  "events": [
    {
      "dedupe_key": "alpha_vantage:WDC:2026-05-04:storage",
      "event_type": "news_sentiment",
      "fetched_at": "2026-05-04T14:15:00Z",
      "id": "av-wdc-2026-05-04-storage",
      "published_at": "2026-05-04T14:10:00Z",
      "raw": {},
      "relevance_score": 0.79,
      "sentiment": "positive",
      "source": "alpha_vantage",
      "summary": "Storage coverage cites HDD and flash demand from data-center customers.",
      "symbol": "WDC",
      "title": "Storage suppliers extend rally on cloud infrastructure demand",
      "url": "https://www.alphavantage.co/"
    }
  ],
  "generated_at": "2026-05-08T18:07:58.330554Z",
  "macro": [
    {
      "dedupe_key": "fred:DGS10:2026-01-02",
      "event_type": "macro_series_observation",
      "fetched_at": "2026-01-02T21:15:00Z",
      "id": "fred-DGS10-2026-01-02",
      "published_at": "2026-01-02T21:00:00Z",
      "raw": {},
      "relevance_score": 0.8,
      "sentiment": "neutral",
      "source": "fred",
      "summary": "DGS10 observation available for macro trend filter.",
      "symbol": "DGS10",
      "title": "10-Year Treasury Constant Maturity Rate",
      "url": "https://fred.stlouisfed.org/series/DGS10",
      "value": 4.12
    },
    {
      "dedupe_key": "fred:FEDFUNDS:2026-01-01",
      "event_type": "macro_series_observation",
      "fetched_at": "2026-01-02T21:15:00Z",
      "id": "fred-FEDFUNDS-2026-01-01",
      "published_at": "2026-01-01T21:00:00Z",
      "raw": {},
      "relevance_score": 0.78,
      "sentiment": "neutral",
      "source": "fred",
      "summary": "Fed funds observation available for regime review.",
      "symbol": "FEDFUNDS",
      "title": "Effective Federal Funds Rate",
      "url": "https://fred.stlouisfed.org/series/FEDFUNDS",
      "value": 4.33
    }
  ],
  "news": [
    {
      "dedupe_key": "alpha_vantage:WDC:2026-05-04:storage",
      "event_type": "news_sentiment",
      "fetched_at": "2026-05-04T14:15:00Z",
      "id": "av-wdc-2026-05-04-storage",
      "published_at": "2026-05-04T14:10:00Z",
      "raw": {},
      "relevance_score": 0.79,
      "sentiment": "positive",
      "source": "alpha_vantage",
      "summary": "Storage coverage cites HDD and flash demand from data-center customers.",
      "symbol": "WDC",
      "title": "Storage suppliers extend rally on cloud infrastructure demand",
      "url": "https://www.alphavantage.co/"
    }
  ],
  "notes": [
    "Context excludes records published after the signal timestamp."
  ],
  "signal_id": "sig_f736de2bc296dbd9",
  "symbol": "WDC"
}
